{
  "accession": null,
  "register_id": "M23",
  "common_name": "All Your Base",
  "binomial": "Textus imperativus",
  "first_outbreak": 1991,
  "peak": 2001,
  "status": "extinct",
  "undead_rating": 2,
  "habitat": "Retro-gaming nostalgia posts and 'oldest internet memes' listicles, this one included.",
  "diet": "Feeds on a mistranslated imperative sentence rendered with total sincerity.",
  "predators": "None. No litigation has ever attached to the phrase or the screenshot.",
  "transmission": "Historically: song remixes and image macros of the game's opening cutscene. Today: text-only references, since the screenshot itself is not safely reproducible.",
  "cause_of_death": "The format simply aged out; nothing suppressed it.",
  "resurrection": "Referenced, not revived — almost always as a dated joke about a dated joke.",
  "host_population": "Gaming-culture nostalgia contexts specifically.",
  "mutation": "Extensive during its active remix period (2001-2003); none since.",
  "prognosis": "Set the phrase in the museum's own type. The screenshot is copyrighted even if the six words arguably are not.",
  "display_tier": "D2",
  "display_decision": "declined",
  "rights_holder": "Game publisher and successors",
  "evidence_grade": "Unverified this pass",
  "image_mode": null,
  "attribution": null,
  "commentary": null,
  "sources": [],
  "identifiable_person": "No",
  "minor_in_image": "No",
  "merch_posture": "Never pursue",
  "underlying_work": "Video game screen text",
  "enforcement_history": "None found.",
  "curatorial_note": "The text is short enough that copyright in the phrase alone is doubtful, but the screenshot is not. Set the phrase in your own type and skip the image."
}
