{
  "accession": null,
  "register_id": "M26",
  "common_name": "Charlie Bit My Finger",
  "binomial": null,
  "first_outbreak": 2007,
  "peak": null,
  "status": null,
  "undead_rating": null,
  "habitat": null,
  "diet": null,
  "predators": null,
  "transmission": null,
  "cause_of_death": null,
  "resurrection": null,
  "host_population": null,
  "mutation": null,
  "prognosis": null,
  "display_tier": "D3",
  "display_decision": "unavailable",
  "rights_holder": "The children's father as author; the two children as subjects",
  "evidence_grade": "Reported, not verified this pass",
  "image_mode": null,
  "attribution": null,
  "commentary": null,
  "sources": [],
  "identifiable_person": "Yes",
  "minor_in_image": "Yes (both, aged approximately one and three)",
  "merch_posture": "Never pursue",
  "underlying_work": "Home video of two children",
  "enforcement_history": "No litigation found. The original upload was sold at auction in 2021 and briefly removed from its platform as part of that sale.",
  "curatorial_note": "The strongest minor-subject case in the collection and the clearest instance where copyright is the lesser problem. Two children were filmed in a domestic setting and have spent their entire lives as a reaction image. The museum's position here is ethical before it is legal, and the wall label should say so rather than citing statute."
}
