{
  "accession": null,
  "register_id": "M08",
  "common_name": "Disaster Girl",
  "binomial": null,
  "first_outbreak": 2005,
  "peak": null,
  "status": null,
  "undead_rating": null,
  "habitat": null,
  "diet": null,
  "predators": null,
  "transmission": null,
  "cause_of_death": null,
  "resurrection": null,
  "host_population": null,
  "mutation": null,
  "prognosis": null,
  "display_tier": "D2",
  "display_decision": "declined",
  "rights_holder": "Zoe Roth and her father, the photographer",
  "evidence_grade": "Reported, not verified this pass",
  "image_mode": null,
  "attribution": null,
  "commentary": null,
  "sources": [],
  "identifiable_person": "Yes",
  "minor_in_image": "Yes (four at time of photo)",
  "merch_posture": "Never pursue",
  "underlying_work": "Photograph of a child",
  "enforcement_history": "No litigation found. Subject sold an NFT of the image in 2021 and retained the copyright.",
  "curatorial_note": "The owner has demonstrated the image has six-figure commercial value, which destroys any market-effect argument you might otherwise make."
}
