{
  "accession": null,
  "register_id": "M25",
  "common_name": "Chuck Norris Facts",
  "binomial": null,
  "first_outbreak": 2005,
  "peak": null,
  "status": null,
  "undead_rating": null,
  "habitat": null,
  "diet": null,
  "predators": null,
  "transmission": null,
  "cause_of_death": null,
  "resurrection": null,
  "host_population": null,
  "mutation": null,
  "prognosis": null,
  "display_tier": "D3",
  "display_decision": "unavailable",
  "rights_holder": "The Norris estate or authorized successor for name and likeness; Ian Spector and Penguin for the compiled books",
  "evidence_grade": "Verified",
  "image_mode": null,
  "attribution": null,
  "commentary": null,
  "sources": [
    "https://www.casemine.com/judgement/us/59146b3fadd7b049342f983e",
    "https://apnews.com/article/chuck-norris-dies-b92804d43c6eee0d9e3fb31583d7f877"
  ],
  "identifiable_person": "Yes",
  "minor_in_image": "No",
  "merch_posture": "Never pursue",
  "underlying_work": "Crowd-written text corpus, plus name, likeness, and registered marks",
  "enforcement_history": "Suit filed 21 December 2007 in the Southern District of New York against Penguin Group, Ian Spector, and Qubefactor, alleging trademark, false-endorsement, privacy/publicity, and related claims. A temporary restraining order to halt sales was denied the same day.",
  "curatorial_note": "The most instructive row in the register: this meme has no image, yet litigation still arose over the words, name, and commercial framing. Norris died on 19 March 2026; any name-and-likeness assessment must now account for the estate and jurisdiction-specific post-mortem rules. Sources disagree on whether the fact generator began in 2003 or summer 2005; the museum uses 2005, consistent with ADR 0002."
}
