{
  "accession": null,
  "register_id": "M12",
  "common_name": "Hide the Pain Harold",
  "binomial": null,
  "first_outbreak": 2011,
  "peak": null,
  "status": null,
  "undead_rating": null,
  "habitat": null,
  "diet": null,
  "predators": null,
  "transmission": null,
  "cause_of_death": null,
  "resurrection": null,
  "host_population": null,
  "mutation": null,
  "prognosis": null,
  "display_tier": "D2",
  "display_decision": "declined",
  "rights_holder": "Photographer and agency, with the model now commercially active",
  "evidence_grade": "Reported, not verified this pass",
  "image_mode": null,
  "attribution": null,
  "commentary": null,
  "sources": [],
  "identifiable_person": "Yes",
  "minor_in_image": "No",
  "merch_posture": "Licence only",
  "underlying_work": "Stock photograph of a model",
  "enforcement_history": "No litigation found. The subject now works with a licensing agent and takes paid commercial engagements.",
  "curatorial_note": "Unusual case. The subject has monetised the meme himself and is publicly reachable, but the photographic copyright sits elsewhere. Two permissions needed, not one."
}
