{
  "accession": null,
  "register_id": "M28",
  "common_name": "LOLCats",
  "binomial": null,
  "first_outbreak": 2006,
  "peak": null,
  "status": null,
  "undead_rating": null,
  "habitat": null,
  "diet": null,
  "predators": null,
  "transmission": null,
  "cause_of_death": null,
  "resurrection": null,
  "host_population": null,
  "mutation": null,
  "prognosis": null,
  "display_tier": "D3",
  "display_decision": "unavailable",
  "rights_holder": "Individual photographers, mostly unidentified; an aggregator network for the platform era",
  "evidence_grade": "Unverified this pass",
  "image_mode": null,
  "attribution": null,
  "commentary": null,
  "sources": [],
  "identifiable_person": "No",
  "minor_in_image": "No",
  "merch_posture": "Never pursue",
  "underlying_work": "Genre, not a single work. Many separately owned photographs with added text",
  "enforcement_history": "No litigation found.",
  "curatorial_note": "A taxon, not a specimen, and the register should say so. There is no single rights holder to approach because there is no single work. The museum can exhibit the genre at taxon level with no image, or split it into named specimens once individual photographs are identified and traced. It is not equivalent to Grumpy Cat, which is one photographed animal with registered marks and a company behind it."
}
