{
  "accession": null,
  "register_id": "M15",
  "common_name": "Woman Yelling at a Cat",
  "binomial": null,
  "first_outbreak": 2019,
  "peak": null,
  "status": null,
  "undead_rating": null,
  "habitat": null,
  "diet": null,
  "predators": null,
  "transmission": null,
  "cause_of_death": null,
  "resurrection": null,
  "host_population": null,
  "mutation": null,
  "prognosis": null,
  "display_tier": "D3",
  "display_decision": "unavailable",
  "rights_holder": "Broadcaster for the still, a private owner for the cat photograph",
  "evidence_grade": "Reported, not verified this pass",
  "image_mode": null,
  "attribution": null,
  "commentary": null,
  "sources": [],
  "identifiable_person": "Yes",
  "minor_in_image": "No",
  "merch_posture": "Never pursue",
  "underlying_work": "Composite: television still plus a photograph",
  "enforcement_history": "No litigation found.",
  "curatorial_note": "Two separate rights holders in one image, one of them a media conglomerate. Composites multiply risk rather than diluting it. Useful teaching point for the exhibit."
}
