{
  "accession": null,
  "register_id": "M22",
  "common_name": "Loss",
  "binomial": null,
  "first_outbreak": 2008,
  "peak": null,
  "status": null,
  "undead_rating": null,
  "habitat": null,
  "diet": null,
  "predators": null,
  "transmission": null,
  "cause_of_death": null,
  "resurrection": null,
  "host_population": null,
  "mutation": null,
  "prognosis": null,
  "display_tier": "D1",
  "display_decision": "declined",
  "rights_holder": "Tim Buckley",
  "evidence_grade": "Unverified this pass",
  "image_mode": null,
  "attribution": null,
  "commentary": null,
  "sources": [],
  "identifiable_person": "No",
  "minor_in_image": "No",
  "merch_posture": "Original redraw only",
  "underlying_work": "Webcomic panels",
  "enforcement_history": "None found.",
  "curatorial_note": "The four-panel abstraction has become separable from the drawing itself. An original abstraction of the layout is almost certainly clear and is the best test case for the whole redraw approach."
}
