{
  "accession": null,
  "register_id": "M16",
  "common_name": "Drakeposting",
  "binomial": null,
  "first_outbreak": 2015,
  "peak": null,
  "status": null,
  "undead_rating": null,
  "habitat": null,
  "diet": null,
  "predators": null,
  "transmission": null,
  "cause_of_death": null,
  "resurrection": null,
  "host_population": null,
  "mutation": null,
  "prognosis": null,
  "display_tier": "D3",
  "display_decision": "unavailable",
  "rights_holder": "Major label and the artist",
  "evidence_grade": "Reported, not verified this pass",
  "image_mode": null,
  "attribution": null,
  "commentary": null,
  "sources": [],
  "identifiable_person": "Yes",
  "minor_in_image": "No",
  "merch_posture": "Never pursue",
  "underlying_work": "Music video stills",
  "enforcement_history": "No litigation found specific to the meme.",
  "curatorial_note": "Label-owned audiovisual work featuring a litigious rights environment. Nothing about the meme's ubiquity changes the ownership."
}
