{
  "accession": null,
  "register_id": "M27",
  "common_name": "Dancing Baby",
  "binomial": null,
  "first_outbreak": 1996,
  "peak": null,
  "status": null,
  "undead_rating": null,
  "habitat": null,
  "diet": null,
  "predators": null,
  "transmission": null,
  "cause_of_death": null,
  "resurrection": null,
  "host_population": null,
  "mutation": null,
  "prognosis": null,
  "display_tier": "D2",
  "display_decision": "declined",
  "rights_holder": "The animators and the successors to the software publisher",
  "evidence_grade": "Unverified this pass",
  "image_mode": null,
  "attribution": null,
  "commentary": null,
  "sources": [],
  "identifiable_person": "No",
  "minor_in_image": "No",
  "merch_posture": "Never pursue",
  "underlying_work": "3D character animation distributed as a software demonstration file",
  "enforcement_history": "No litigation found for the animation itself.",
  "curatorial_note": "Do not conflate this work with the Lenz takedown litigation, which is commonly called the dancing baby case and concerns a different work entirely: a home video of a toddler dancing to a pop record. The specimen predates modern meme-rights case law by a decade, and its chain of title runs through corporate acquisitions rather than an identifiable author."
}
