{
  "accession": null,
  "register_id": "M11",
  "common_name": "Socially Awkward Penguin",
  "binomial": null,
  "first_outbreak": 2009,
  "peak": null,
  "status": null,
  "undead_rating": null,
  "habitat": null,
  "diet": null,
  "predators": null,
  "transmission": null,
  "cause_of_death": null,
  "resurrection": null,
  "host_population": null,
  "mutation": null,
  "prognosis": null,
  "display_tier": "D3",
  "display_decision": "unavailable",
  "rights_holder": "Getty Images, on behalf of the original publisher",
  "evidence_grade": "Reported, not verified this pass",
  "image_mode": null,
  "attribution": null,
  "commentary": null,
  "sources": [],
  "identifiable_person": "No",
  "minor_in_image": "No",
  "merch_posture": "Never pursue",
  "underlying_work": "Wildlife photograph",
  "enforcement_history": "Reported licensing demands issued to European sellers in the 2010s.",
  "curatorial_note": "Agency-held, and the agency has a documented practice of chasing small European resellers. Treat like stock."
}
